7009,Albus Dumbledore,is he in this room?
7010,Albus Dumbledore,is he in this room?
7011,Albus Dumbledore,harry get away from there!
7012,Albus Dumbledore,are you alright alastor?
7013,Alastor Moody,i'm sorry albus.
7014,Harry Potter,that's moody but then who's...?
7015,Severus Snape,polyjuice potion.
7016,Albus Dumbledore,now we know who's been stealing it from your store severus.
7017,Albus Dumbledore,we'll get you up in a minute.
7018,Albus Dumbledore,barty crouch junior.
7019,Bartemius Crouch Junior,i'll show you mine if you show me yours.
7020,Albus Dumbledore,your arm harry.
7021,Bartemius Crouch Junior,you know what this means don't you?
7022,Bartemius Crouch Junior,he's back.
7023,Bartemius Crouch Junior,lord voldemort has returned.
7024,Albus Dumbledore,send an owl to azkaban think they'll find they're missing a prisoner.
7025,Bartemius Crouch Junior,i'll be welcomed back like a hero.
7026,Albus Dumbledore,perhaps.
7027,Albus Dumbledore,personally i've never had much time for heroes.
7028,Albus Dumbledore,today we acknowledge a really terrible loss.
7029,Albus Dumbledore,cedric diggory was as you all know exceptionally hard working intricately fair minded.
7030,Albus Dumbledore,and most importantly a fierce fierce friend.
7031,Albus Dumbledore,i think therefore you have the right to know exactly how he died.
7032,Albus Dumbledore,you see cedric diggory was murdered by lord voldemort.
7033,Albus Dumbledore,the ministry of magic does not wish me to tell you this.
7034,Albus Dumbledore,but not to do so i think would be an insult to his memory.
7035,Albus Dumbledore,now the pain we all feel at this dreadful loss reminds me reminds us that while we may come from different places and speak in different tongues our hearts beat as one.
7036,Albus Dumbledore,in light of recent events the bonds of friendship we made this year will be more important than ever.
7037,Albus Dumbledore,remember that and cedric diggory will not have died in vain you remember that.
7038,Albus Dumbledore,and we'll celebrate a boy who was kind and honest and brave and true right to the very end.
7039,Albus Dumbledore,i never liked these curtains.
7040,Albus Dumbledore,set them on fire in my fourth year by accident of course.
7041,Albus Dumbledore,i put you in terrible danger this year harry i'm sorry.
7042,Harry Potter,professor when i was in the graveyard there was a moment... um... when voldemort's wand and mine sort of connected.
7043,Albus Dumbledore,priori incantatem.
7044,Albus Dumbledore,you saw your parents that night didn't you?
7045,Albus Dumbledore,they reappeared.
7046,Albus Dumbledore,no spell can reawaken the dead harry i trust you know that.
7047,Albus Dumbledore,dark and diffiult times lie ahead.
7048,Albus Dumbledore,soon we must all face the choice between what is right what is easy.
7049,Albus Dumbledore,but remember this you have friends here.
7050,Albus Dumbledore,you're not alone.
7051,Viktor Krum,write to me.
7052,Viktor Krum,promise.
7053,Hermione Granger,bye.
7054,Fleur Delacour,au revoir ron.
7055,Ron Weasley,do you think we'll ever just have a quiet year at hogwarts?
7056,Hermione Granger,no.
7057,Harry Potter,no i don't think so.
7058,Hermione Granger,everything's going to change now isn't it?
7059,Harry Potter,yes.
7060,Hermione Granger,promise you'll write this summer.
7061,Hermione Granger,both of you.
7062,Ron Weasley,well i won't.
7063,Ron Weasley,you know i won't!
7064,Hermione Granger,harry will won't you?
7065,Dudley Dursley,oh it's you.
7066,Gang thug,what should we do with him big d?
7067,Harry Potter,big d?
7068,Harry Potter,cool name but to me you'll always be ikkle duddicums.
7069,Dudley Dursley,shut up!
7070,Dudley Dursley,ooo tough guy.
7071,Dudley Dursley,not so tough in your bed are you?
7072,Harry Potter,what?
7073,Arabella Figg,you boys go home now or i'll be calling your parents!
7074,Dudley Dursley,i heard you talking in your sleep last night.
7075,Dudley Dursley,crying.
7076,Dudley Dursley,"""no don't kill cedric don't kill cedric!"
7077,Dudley Dursley,dad help me heeelp me!
7078,Dudley Dursley,he's going to kill me!
7079,Dudley Dursley,"boo-hoo!"""
7080,Harry Potter,shut up dudley.
7081,Harry Potter,i'm warning you...
7082,Dudley Dursley,why should i?
7083,Harry Potter,because if you don't i'll turn you into the idiot pig you are!
7084,Harry Potter,not so brave now are you duddykins?
7085,Harry Potter,now tell your little friends to go away.
7086,Dudley Dursley,g-go home!
7087,Gang thug,what?
7088,Dudley Dursley,get out of here!
7089,Harry Potter,don't you ever speak about that again.
7090,Harry Potter,you understand?
7091,Dudley Dursley,don't point that thing at me!
7092,Harry Potter,i said do you understand?
7094,Dudley Dursley,what's happening?
7095,Harry Potter,quiet!
7096,Harry Potter,dudley!
7097,Harry Potter,run!
7098,Harry Potter,come on!
7099,Harry Potter,they break into a run.
7100,Harry Potter,a dementor drifts into the alleyway in front of them.
7101,Harry Potter,skidding to a stop harry turns around to find the other dementor cutting off the way back.
7102,Harry Potter,dudley no!
7103,Harry Potter,lumos!
7104,Harry Potter,"""expecto patronum!'"
7105,Voldemort,bow to death harry...
7106,Lily Potter,haaaaaaaarry!...
7107,Harry Potter,"""expecto patronum! '"
7108,Vernon Dursley,what the heii are those?
7109,Harry Potter,dementors.
7110,Petunia Dursley,what happened duddikins?
7111,Vernon Dursley,what the hell is a dementoid?
7112,Petunia Dursley,they didn't--?
7113,Harry Potter,no.
7114,Vernon Dursley,i want some answers!
7115,Harry Potter,we were attacked.
7116,Vernon Dursley,by those...things?
7117,Harry Potter,they're evil.
7118,Harry Potter,if they get the chance they'll suck your soul out through your mouth.
7119,Vernon Dursley,how do you know that?
7120,Vernon Dursley,fought 'em off eh dud?
7121,Vernon Dursley,gave 'em the ol' one-two?
7122,Harry Potter,you can't give a dementor the 'ol one-two.'
7123,Vernon Dursley,why is he all right then?
7124,Harry Potter,because i used magic to save his
7125,Harry Potter,lumos!
7126,Vernon Dursley,who are all you lot?
7127,Alastor Moody,quiet dursley.
7128,Remus Lupin,harry douse the light.
7129,Remus Lupin,we're exposed here.
7130,Harry Potter,what are you doing here?
7131,Remus Lupin,we're your advanced guard harry.
7132,Remus Lupin,dumbledore just sent us as soon as he heard about the attack.
7133,Remus Lupin,we're taking you to safety.
7134,Remus Lupin,we're just waiting for the all clear.
7135,Harry Potter,how'd he know?
7136,Harry Potter,it just happened!
7137,Remus Lupin,you didn't think dumbledore'd let you wander around on your own did you?
7138,Remus Lupin,harry i don't believe you've met nymphadora tonks.
7139,Remus Lupin,tonks would you go get harry's broom from the house?
7140,Harry Potter,what's been going on?
7141,Harry Potter,what's lord vol-
7142,Alastor Moody,we're not talking about it here it's too risky.
7143,Alastor Moody,blast it.
7144,Nymphadora Tonks,mad-eye dear you do realize that's disgusting?
7145,Alastor Moody,i want 365 degree visibility on the return trip.
7146,Harry Potter,how are we getting there?
7147,Remus Lupin,brooms.
7148,Kingsley Shacklebolt,there's the first signal.
7149,Alastor Moody,right let's go.
7150,Remus Lupin,on your broom harry.
7151,Alastor Moody,form up!
7152,Alastor Moody,form up around harry.
7153,Alastor Moody,make it snappy!
7154,Alastor Moody,the advanced guard surrounds harry.
7155,Nymphadora Tonks,stop being so cheerful mad-eye.
7156,Alastor Moody,we must be ready.
7157,Alastor Moody,this would be the perfect moment for voldemort to strike harry.
7158,Harry Potter,uh is that very likely?
7159,Kingsley Shacklebolt,no one's going to die.
7160,Remus Lupin,there's the second signal!
7161,Alastor Moody,mount your brooms everyone.
7162,Alastor Moody,here we go!
7163,Alastor Moody,the third signal everyone.
7164,Alastor Moody,let's
7165,Alastor Moody,stay in formation!
7166,Alastor Moody,we need more height!
7167,Alastor Moody,contacts to the south!
7168,Kingsley Shacklebolt,mad-eye!
7169,Kingsley Shacklebolt,you tonks and lupin take harry!
7170,Kingsley Shacklebolt,we'll slow them down!
7171,Remus Lupin,there's the other one alastor!
7172,Harry Potter,expecto--!
7173,Remus Lupin,harry leave it to us!
7174,Harry Potter,no!
7175,Remus Lupin,"""expecto patronum!'"
7176,Remus Lupin,get harry to the safe house!
7177,Alastor Moody,come on potter!
7178,Alastor Moody,keep moving!
7179,Harry Potter,but i can help!
7180,Alastor Moody,potter getting yourself killed won't do a thing.
7181,Alastor Moody,now move!
7182,Alastor Moody,we're not far now!
7183,Alastor Moody,did you get rid of them?
7184,Kingsley Shacklebolt,they're gone alastor.
7185,Nymphadora Tonks,we're there!
7186,Alastor Moody,prepare for descent!
7187,Alastor Moody,form up around harry!
7188,Remus Lupin,stay here harry.
7189,Kingsley Shacklebolt,clear!
7190,Alastor Moody,right harry this way.
7191,Alastor Moody,here read this.
7192,Alastor Moody,come on inside.
7193,Alastor Moody,hurry.
7194,Remus Lupin,get in quick harry.
7195,Remus Lupin,don't touch anything.
7196,Walburga Black,filth!
7197,Walburga Black,scum!
7198,Walburga Black,half-breeds mutants freaks begone from this place!
7199,Walburga Black,how dare you befoul the house of my fathers?
7201,Sirius Black,shut up you miserable old hag!
7202,Sirius Black,quiet!
7203,Walburga Black,blood traitor abomination shame of my flesh!
7204,Harry Potter,was that your--?
7205,Sirius Black,mother yes.
7206,Sirius Black,dear old mum.
7207,Harry Potter,but...why here?
7208,Molly Weasley,hello harry dear.
7209,Harry Potter,mrs. weasley!
7210,Molly Weasley,sirius the meeting is about to start!
7211,Sirius Black,right.
7212,Molly Weasley,harry dear go on upstairs-— quietly if you please.
7213,Molly Weasley,they're all up there.
7214,Hermione Granger,harry!
7215,Ron Weasley,let him breathe hermione!
7216,Hermione Granger,oh harry!
7217,Hermione Granger,we've missed you!
7218,Hermione Granger,are you furious with us i bet you are!
7219,Ron Weasley,good to see you mate.
7220,Hermione Granger,come on inside.
7221,Hermione Granger,sorry we haven't written harry but dumbledore made us promise not to.
7222,Ron Weasley,we wanted to mate we really did but he thought they would get intercepted.
7223,Ron Weasley,there is an awkward silence.
7224,Harry Potter,right.
7225,Ron Weasley,he thought you would be safest there.
7226,Hermione Granger,he was so angry when he heard.
7227,Hermione Granger,it was...scary...
7228,Harry Potter,so why's he keeping me in the dark?
7229,Harry Potter,didn't you bother asking?
7230,Ron Weasley,we've only seen him twice and not for very long.
7231,Ron Weasley,he's really busy.
7232,Harry Potter,so i get to spend the summer with the dursleys while you two are here.
7233,Ron Weasley,it's not that fun mate.
7234,Ron Weasley,mum won't let us anywhere near the meetings.
7235,Harry Potter,you've still been here!
7236,Harry Potter,what's been going on?
7237,Ron Weasley,we've already told you we're not privyed to the meetings.
7238,Ron Weasley,but we do know a few things.
7239,Hermione Granger,some of the order are following known death eaters like lucious malfoy.
7240,Harry Potter,what's this order everyone's talking about?
7241,Hermione Granger,the order of the phoenix.
7242,Hermione Granger,dumbledore started it last time to fight you-know-who.
7243,Hermione Granger,he only reorganized it after last term.
7244,Molly Weasley,you can come down now the meeting's over.
7245,Molly Weasley,arthur-
7246,Sirius Black,well the ministry is furious with you.
7247,Harry Potter,why?
7248,Sirius Black,you'll have to go to an disciplinary meeting tomorrow.
7249,Harry Potter,okay.
7250,Harry Potter,i'm not really hungry.
7251,Harry Potter,i think i'll go to bed.
7252,Sirius Black,you surprise me harry.
7253,Sirius Black,i figured the first thing you'd do is start asking about voldemort.
7254,Harry Potter,i wanted to but i didn't think you'd tell me anything.
7255,Molly Weasley,and that was quite right harry!
7256,Molly Weasley,you're much to young--
7257,Sirius Black,he has a right to know molly.
7258,Molly Weasley,it's not your decision!
7259,Sirius Black,i know what dumbledore said but he needs to know something.
7260,Sirius Black,he's not a child molly.
7261,Molly Weasley,he's not an adult either!
7262,Molly Weasley,i only have harry's best interests at heart.
7263,Sirius Black,he's not your son.
7264,Molly Weasley,who else does he have then?
7265,Sirius Black,he's got me.
7266,Sirius Black,he's like a son to me.
7267,Sirius Black,what do you want to know harry?
7268,Harry Potter,where's voldemort?
7269,Harry Potter,what's he doing?
7270,Sirius Black,he's hiding for the moment because the ministry is ignoring his return and he doesn't want that to change.
7271,Harry Potter,how?
7272,Sirius Black,the last person you-know-who wanted to alert was dumbledore.
7273,Harry Potter,and what's his plan?
7274,Sirius Black,he's building up his army again just like before.
7275,Harry Potter,and you're stopping him from gaining followers?
7276,Remus Lupin,we're doing our best but it's proving to be...difficult.
7277,Sirius Black,you see when the ministry of magic insists that voldemort isn't back.
7278,Harry Potter,but...why?
7279,Remus Lupin,fudge likes being minister of magic.
7280,Remus Lupin,if it turns out that voldemort came back under his watch he'll be sacked.
7281,Harry Potter,but you're telling people right?
7282,Sirius Black,well they think i'm a mass- murderer lupin is a werewolf tonks and arthur would lose their jobs at the ministry...
7283,Remus Lupin,but dumbledore is doing all he can.
7284,Arthur Weasley,if he keeps it up he might end up in azkaban.
7285,Arthur Weasley,and that would give you- know-who a clear field to--
7286,Harry Potter,what?
7287,Sirius Black,you-know-who wants something.
7288,Sirius Black,something he didn't have last time.
7289,Sirius Black,a weapon.
7290,Harry Potter,what kind of weapon?
7291,Remus Lupin,i'm sorry harry we can't say anything more.
7292,Molly Weasley,morning dear!
7293,Molly Weasley,did you have a good sleep?
7294,Harry Potter,no my scar kept hurting.
7295,Harry Potter,yeah...nerves...
7296,Molly Weasley,good luck harry!
7297,Hermione Granger,they'll have to let you off harry... you were defending
7298,Harry Potter,thanks hermione.
7299,Ron Weasley,what does he get a hug for?
7300,Ron Weasley,oh sure that's why.
7301,Ron Weasley,me?
7302,Ron Weasley,jealous?
7303,Ron Weasley,of course not it just doesn't seem fair that you hug one friend more than the other is all...
7304,Hermione Granger,would you like a hug?
7305,Arthur Weasley,well come on harry.
7306,Arthur Weasley,time to go.
7307,Harry Potter,bye.
7308,Arthur Weasley,good good not very many muggles.
7309,Arthur Weasley,well come on harry in we go.
7310,Arthur Weasley,i do love using the fellytone!
7311,Arthur Weasley,now let's see what's the number again...
7312,Witch,welcome to the ministry of magic.
7313,Witch,please state your business.
7314,Arthur Weasley,harry potter disciplinary hearing.
7315,Witch,pleas stand by.
7316,Arthur Weasley,keep close harry!
7317,Arthur Weasley,ah perkins good morn-
7318,Perkins,arthur they've changed the time of potter's hearing.
7319,Arthur Weasley,blast!
7320,Arthur Weasley,dumbledore thought they might try that.
7321,Perkins,it started at eight!
7322,Arthur Weasley,good lord that was five minutes ago!
7323,Arthur Weasley,come on harry!
7324,Witch,department of mysteries.
7325,Harry Potter,department of mysteries?
7326,Arthur Weasley,yep i've got no idea what they get up to in here it's top secret.
7327,Arthur Weasley,come on harry!
7328,Harry Potter,i've been there before...
7329,Arthur Weasley,now harry i find that highly unlikely...
7330,Arthur Weasley,there you are harry in you go...good luck...
7331,Cornelius Fudge,you're late.
7332,Harry Potter,er...sorry.
7333,Cornelius Fudge,no matter the accused will take his seat.
7334,Cornelius Fudge,very well we are ready to begin.
7335,Albus Dumbledore,witness for the defence albus percival wulfric brian dumbledore.
7336,Cornelius Fudge,ah...you...er...got our message that the time had changed did you?
7337,Cornelius Fudge,well.
7338,Cornelius Fudge,the...ah...charges.
7339,Cornelius Fudge,the charges against the accused shall now be read into the record: that the accused did with deliberation and fore-knowledge of the illegality of his actions produce a patronus charm in full sight of a muggle.
7340,Harry Potter,yes.
7341,Harry Potter,yes but-
7342,Cornelius Fudge,within full sight of a muggle?
7343,Harry Potter,yes but-
7344,Susan Bones,you produced a patronus?
7345,Susan Bones,a fully- formed patronus with a clearly- defined shape?
7346,Harry Potter,yes.
7347,Susan Bones,that is most remarkable mr. potter.
7348,Cornelius Fudge,it doesn't matter how impressive it was!
7349,Harry Potter,but i did it because of the dementors!
7350,Susan Bones,what do you mean?
7351,Harry Potter,my cousin and i were attacked by dementors.
7352,Harry Potter,that's why i had to use the patronus to drive them away.
7353,Cornelius Fudge,ah yes yes another cock-and-bull story.
7354,Susan Bones,dementors in little whinging?
7355,Cornelius Fudge,oh come now susan.
7356,Cornelius Fudge,he's clearly lying.
7357,Cornelius Fudge,we haven't got time to-
7358,Cornelius Fudge,very well.
7359,Cornelius Fudge,weasley fetch the witness.
7360,Cornelius Fudge,full name?
7361,Arabella Figg,arabella doreen figg resident of little whinging.
7362,Cornelius Fudge,so...what is your story?
7363,Arabella Figg,i was sitting on my porch when i saw the two dementors gliding towards the two boys.
7364,Susan Bones,what did the dementors look like?
7365,Arabella Figg,well they were big and wore great tattered cloaks.
7366,Susan Bones,anything else?
7367,Arabella Figg,i-i felt them.
7368,Arabella Figg,it was horrible...like i would never be happy again.
7369,Cornelius Fudge,very well you may go.
7370,Cornelius Fudge,not very convincing.
7371,Susan Bones,oh i disagree.
7372,Susan Bones,she described their effects very completely.
7373,Cornelius Fudge,so two dementors just happen to be in little whinging?
7374,Cornelius Fudge,i think not...
7375,Albus Dumbledore,only if the dementors are still taking their orders from only the ministry these days.
7376,Albus Dumbledore,i believe you know my views on this cornelius.
7377,Cornelius Fudge,yes and they're nothing but bilge dumbledore.
7378,Dolores Umbridge,excuse me dumbledore but did you just accused the ministry of magic of ordering an attack on this boy?
7379,Cornelius Fudge,dementors are irrelevant!
7380,Cornelius Fudge,well yes if he's telling the truth!
7381,Cornelius Fudge,very well all for clearing the accused of charges?
7382,Cornelius Fudge,all opposed?
7383,Albus Dumbledore,excellent.
7384,Arthur Weasley,harry you've been let off!
7385,Arthur Weasley,that's wonderful!
7386,Arthur Weasley,you were tried by the full court?
7387,Harry Potter,i think so yeah.
7388,Harry Potter,er...is percy mad at you?
7389,Arthur Weasley,ah...yes...i'm afraid we had a bit of a row.
7390,Arthur Weasley,he well he sided with fudge and the rest of us sided with dumbledore so percy left.
7391,Lucius Malfoy,well well if it isn't patronus potter.
7392,Harry Potter,what are you doing here?
7393,Lucius Malfoy,come now potter i really don't think that private matters between the minister and myself are any concern of yours.
7394,Lucius Malfoy,shall we continue this in your
7395,Cornelius Fudge,certainly.
7396,Harry Potter,if he wanted to talk to the minister why down here?
7397,Arthur Weasley,dunno harry.
7398,Arthur Weasley,some things are just beyond comprehension.
7399,Arthur Weasley,settle down you three!
7400,Arthur Weasley,sirius we saw fudge talking with lucius malfoy on level nine again.
7401,Arthur Weasley,tell dumbledore next time he comes in would you?
7402,Sirius Black,yeah absolutely.
7403,Arthur Weasley,well i'd better be off.
7404,Arthur Weasley,i've got a bewitched vomiting toilet to deal with.
7405,Fred Weasley,george remember that concept.
7406,Fred Weasley,vomiting toilet.
7407,George Weasley,right you are fred.
7408,Arthur Weasley,also i'm covering for tonks on guard duty later tonight so i won't be back until late.
7409,Sirius Black,harry!
7410,Sirius Black,you all right harry?
7411,Harry Potter,yeah...just...my scar...the pain is getting stronger.
7412,Sirius Black,harry i've got something that might interest you.
7413,Sirius Black,this was the original order of the phoenix.
7414,Sirius Black,found it while we were cleaning.
7415,Sirius Black,there's mad-eye and dumbledore right next to dedalus diggle; marlene mckinnon she was killed two weeks after this was taken...;
7416,Sirius Black,then there's frank and alice longbottom tortured into insanity by death eaters; lupin of course..
7417,Harry Potter,my parents.
7418,Harry Potter,i miss them sirius...
7419,Sirius Black,i know harry i know.
7420,Sirius Black,i miss them too.
7421,Sirius Black,it's not fair that i got to spend so much time with them and you didn't...
7422,Harry Potter,why'd they have to die sirius why?
7423,Sirius Black,i know i'm not your father harry but i'll always be there for you if i can help it...
7424,Harry Potter,thanks.
7425,Sirius Black,kreacher get out of here!
7426,Sirius Black,now!
7427,Kreacher,oh how the old mistress would weep to see the traitor in her house...
7428,Harry Potter,who..who was that?
7429,Sirius Black,kreacher.
7430,Sirius Black,he's been alone with the house for years he's gone a bit funny.
7431,Hermione Granger,harry ron and i we've been named house prefects!
7432,Hermione Granger,she hands harry a letter.
7433,Hermione Granger,what about you harry?
7434,Hermione Granger,are you sure?
7435,Hermione Granger,i would have thought you would get one!
7436,Harry Potter,i'm sure.
7437,Harry Potter,nothing.
7438,Harry Potter,so...congratulations ron hermione...
7439,Ron Weasley,come on lets go back downstairs!
7440,Harry Potter,yes do go enjoy yourselves.
7441,Harry Potter,what is that?
7442,Harry Potter,yes it is it's right there!
7443,Luna Lovegood,i see them too harry.
7444,Harry Potter,er...you are?
7445,Luna Lovegood,luna.
7446,Luna Lovegood,luna lovegood.
7447,Harry Potter,well thanks luna.
7448,Harry Potter,hagrid's cabin looks deserted.
7449,Hermione Granger,i hope he's all right...
7450,Ron Weasley,what if he were still on his...
7451,Ron Weasley,what if he's still on his mission from dumbledore?
7452,Harry Potter,yeah could be.
7453,Albus Dumbledore,i beg a few moments of your attention as i have a few start of term announcements.
7454,Albus Dumbledore,right off our caretaker the good mr. filch has reminded me for what he says is the four-hundred and sixty-second time that he had an annually updated list of various banned items usually introduced by our humour experts fred and george weasley...
7455,Albus Dumbledore,... which are posted in an extensive list on the door to mr. filch's door.
7456,Albus Dumbledore,also we have two staffing changes this year.
7457,Albus Dumbledore,professor grubby-plank will be taking the post of care of magical creatures post as professor hagrid is on...extended leave.
7458,Albus Dumbledore,additionally we have professor umbridge who has kindly agreed to fill the post of defense against the dark arts-—
7459,Dolores Umbridge,hem hem headmaster if i could address the school?
7460,Dolores Umbridge,thank you headmaster.
7461,Dolores Umbridge,now how are we all doing tonight?
7462,Dolores Umbridge,i thought i would just say a few words.
7463,Dolores Umbridge,i am here at the ministry of magic's bequest under educational decree twenty-two which states that if the headmaster of hogwarts is unable to fill any teaching post the ministry shall select one for the position.
7464,Dean Thomas,so why didn't your mum want you to come back to hogwarts seamus?
7465,Harry Potter,what?
7466,Seamus Finnigan,me mam didn't want me to come back to hogwarts...
7467,Harry Potter,why?
7468,Seamus Finnigan,well...because of you...
7469,Harry Potter,what did i do?
7470,Seamus Finnigan,she...well she figure's you're well...you're lying about you-know- who and dumbledore's a right nutter...
7471,Harry Potter,where'd she get that from?
7472,Harry Potter,no one believes me hedwig.
7473,Harry Potter,no one...
7474,Harry Potter,i'm alone...
7475,Harry Potter,sorry professor...
7476,Dolores Umbridge,hmm let's see five points from gryffindor for coming in late.
7477,Dolores Umbridge,now as i was saying before mr. potter interrupted with his antics your defense against the dark arts education has been rather fragmented and disjointed in your past classes hasn't it?
7478,Dolores Umbridge,i will be following a pre-approved ministry-prepared theory-centered defense lesson plan.
7479,Dolores Umbridge,copy this down.
7480,Dolores Umbridge,yes?
7481,Hermione Granger,i wanted to know something about your course aims.
7482,Dolores Umbridge,well they should be perfectly self- evident.
7483,Hermione Granger,but surely the whole point of defense against the dark arts is practical application?
7484,Dolores Umbridge,miss granger this class has been approved by ministry experts.
7485,Dolores Umbridge,are you a ministry expert?
7486,Hermione Granger,no but-
7487,Dolores Umbridge,then you have no business challenging those who are.
7488,Dolores Umbridge,we will be learning about spells in a safe risk-free environment-
7489,Hermione Granger,but we've got o.w.l.s coming up!
7490,Hermione Granger,you expect us to do the spells with no practice?
7491,Harry Potter,what good's theory in the real world?
7492,Harry Potter,what about lord voldemort?
7493,Dolores Umbridge,ten points from gryffindor mr. potter.
7494,Dolores Umbridge,let me set the record straight.
7495,Dolores Umbridge,some of you have been told that a certain dead wizard has returned.
7496,Dolores Umbridge,this is a lie.
7497,Harry Potter,it-is-not-a-lie!
